{
  "queue_id": "objaverse_furniture_review_queue_v0",
  "source_id": "objaverse_furniture_v0",
  "policy_id": "objaverse_furniture_ingestion_v0",
  "created_at": "2026-03-18T00:00:00+00:00",
  "candidate_count": 0,
  "notes": "Template review queue for the first Objaverse furniture-ingestion wave.",
  "candidates": []
}
