{
  "queue_id": "objaverse_furniture_mock_harvest_v0_review_queue_v0",
  "source_id": "objaverse_furniture_v0",
  "policy_id": "objaverse_furniture_ingestion_v0",
  "created_at": "2026-03-19T15:05:56+00:00",
  "candidate_count": 7,
  "notes": "Review queue generated by the first v0 rule-based narrowing pass from a validated metadata-harvest artifact.",
  "candidates": [
    {
      "candidate_id": "sofa__objv_mock_sofa_001",
      "object_uid": "objv_mock_sofa_001",
      "source_url": "https://example.org/objaverse/objv_mock_sofa_001",
      "title": "Modern sectional sofa",
      "license": "CC0",
      "category_guess": "sofa",
      "review_status": "pending",
      "filter_trace": {
        "license_rule": "allowed_default",
        "category_rule": "keyword_match:sofa",
        "format_rule": "preferred_format_present",
        "notes": "Generated by the v0 rule-based narrowing pass."
      },
      "mesh_format": "glb",
      "triangle_count": 45210,
      "bounds": {
        "width": 2.1,
        "depth": 0.95,
        "height": 0.9
      },
      "source_tags": [
        "living room",
        "sofa",
        "sectional"
      ],
      "review_notes": "Auto-generated candidate from metadata harvest. Description: Textured living-room sofa with cushions.",
      "has_preview": true,
      "preview_ref": {
        "path": "https://example.org/thumbs/objv_mock_sofa_001.png",
        "kind": "remote_url"
      }
    },
    {
      "candidate_id": "armchair__objv_mock_chair_001",
      "object_uid": "objv_mock_chair_001",
      "source_url": "https://example.org/objaverse/objv_mock_chair_001",
      "title": "Lounge armchair",
      "license": "CC-BY 4.0",
      "category_guess": "armchair",
      "review_status": "pending",
      "filter_trace": {
        "license_rule": "allowed_default",
        "category_rule": "keyword_match:armchair",
        "format_rule": "preferred_format_present",
        "notes": "Generated by the v0 rule-based narrowing pass."
      },
      "mesh_format": "obj",
      "triangle_count": 18120,
      "bounds": {
        "width": 0.85,
        "depth": 0.82,
        "height": 0.96
      },
      "source_tags": [
        "armchair",
        "lounge chair"
      ],
      "review_notes": "Auto-generated candidate from metadata harvest. Description: Padded accent chair for a living room.",
      "has_preview": true,
      "preview_ref": {
        "path": "https://example.org/thumbs/objv_mock_chair_001.png",
        "kind": "remote_url"
      }
    },
    {
      "candidate_id": "coffee_table__objv_mock_table_001",
      "object_uid": "objv_mock_table_001",
      "source_url": "https://example.org/objaverse/objv_mock_table_001",
      "title": "Round coffee table",
      "license": "CC0",
      "category_guess": "coffee_table",
      "review_status": "pending",
      "filter_trace": {
        "license_rule": "allowed_default",
        "category_rule": "keyword_match:coffee_table",
        "format_rule": "preferred_format_present",
        "notes": "Generated by the v0 rule-based narrowing pass."
      },
      "mesh_format": "gltf",
      "bounds": {
        "width": 0.75,
        "depth": 0.75,
        "height": 0.42
      },
      "source_tags": [
        "center table",
        "living room"
      ],
      "review_notes": "Auto-generated candidate from metadata harvest. Description: Small circular center table."
    },
    {
      "candidate_id": "floor_lamp__objv_mock_lamp_001",
      "object_uid": "objv_mock_lamp_001",
      "source_url": "https://example.org/objaverse/objv_mock_lamp_001",
      "title": "Standing floor lamp",
      "license": "CC-BY 4.0",
      "category_guess": "floor_lamp",
      "review_status": "pending",
      "filter_trace": {
        "license_rule": "allowed_default",
        "category_rule": "keyword_match:floor_lamp",
        "format_rule": "preferred_format_missing",
        "notes": "Generated by the v0 rule-based narrowing pass."
      },
      "mesh_format": "fbx",
      "source_tags": [
        "standing lamp",
        "living room lighting"
      ],
      "review_notes": "Auto-generated candidate from metadata harvest. Description: Tall floor lamp with fabric shade.",
      "has_preview": true,
      "preview_ref": {
        "path": "https://example.org/thumbs/objv_mock_lamp_001.png",
        "kind": "remote_url"
      }
    },
    {
      "candidate_id": "tv_stand__objv_mock_tvstand_001",
      "object_uid": "objv_mock_tvstand_001",
      "source_url": "https://example.org/objaverse/objv_mock_tvstand_001",
      "title": "Oak media console tv stand",
      "license": "CC0",
      "category_guess": "tv_stand",
      "review_status": "pending",
      "filter_trace": {
        "license_rule": "allowed_default",
        "category_rule": "keyword_match:tv_stand",
        "format_rule": "preferred_format_present",
        "notes": "Generated by the v0 rule-based narrowing pass."
      },
      "mesh_format": "glb",
      "source_tags": [
        "media console",
        "television stand"
      ],
      "review_notes": "Auto-generated candidate from metadata harvest. Description: Wide low storage unit for a television.",
      "has_preview": true,
      "preview_ref": {
        "path": "https://example.org/thumbs/objv_mock_tvstand_001.png",
        "kind": "remote_url"
      }
    },
    {
      "candidate_id": "side_table__objv_mock_sidetable_001",
      "object_uid": "objv_mock_sidetable_001",
      "source_url": "https://example.org/objaverse/objv_mock_sidetable_001",
      "title": "Walnut side table",
      "license": "CC-BY 4.0",
      "category_guess": "side_table",
      "review_status": "pending",
      "filter_trace": {
        "license_rule": "allowed_default",
        "category_rule": "keyword_match:side_table",
        "format_rule": "preferred_format_present",
        "notes": "Generated by the v0 rule-based narrowing pass."
      },
      "mesh_format": "glb",
      "source_tags": [
        "end table",
        "bedside table"
      ],
      "review_notes": "Auto-generated candidate from metadata harvest. Description: Compact side table with one drawer.",
      "has_preview": true,
      "preview_ref": {
        "path": "https://example.org/thumbs/objv_mock_sidetable_001.png",
        "kind": "remote_url"
      }
    },
    {
      "candidate_id": "bookcase__objv_mock_unknownformat_001",
      "object_uid": "objv_mock_unknownformat_001",
      "source_url": "https://example.org/objaverse/objv_mock_unknownformat_001",
      "title": "Bookcase cabinet",
      "license": "CC0",
      "category_guess": "bookcase",
      "review_status": "pending",
      "filter_trace": {
        "license_rule": "allowed_default",
        "category_rule": "keyword_match:bookcase",
        "format_rule": "format_unknown",
        "notes": "Generated by the v0 rule-based narrowing pass."
      },
      "source_tags": [
        "bookcase",
        "storage"
      ],
      "review_notes": "Auto-generated candidate from metadata harvest. Description: Mid-height bookcase without format metadata.",
      "has_preview": true,
      "preview_ref": {
        "path": "https://example.org/thumbs/objv_mock_unknownformat_001.png",
        "kind": "remote_url"
      }
    }
  ]
}
